{"allowed_operations":["bootstrap-alpha","bootstrap-index","ga-activation"],"environment":"stable-release","expires_at":"2026-08-27T00:00:00Z","owner_login":"yaseralnajjar","reason":"User-directed Phase 40 exception while the repository has one maintainer; GitHub-recorded stable-release approval and independent Opus review remain mandatory.","repository":"sifr-lang/sifr","schema_version":2}
